{
  "version": 1,
  "run_id": "RUN_EXAMPLE",
  "created_at": "2025-12-30T02:50:20.342346Z",
  "stage": "A",
  "workdir": "/tmp/agent-builder/RUN_EXAMPLE",
  "repo_root": "",
  "approvals": {
    "A": false,
    "B": false,
    "C": false,
    "D": false,
    "E": false
  },
  "stage-a": {
    "interview_notes_path": "stage-a/interview-notes.md",
    "integration_decision_path": "stage-a/integration-decision.md"
  },
  "stage-b": {
    "blueprint_path": "stage-b/agent-blueprint.json",
    "validated": false
  },
  "stage-c": {
    "planned": false,
    "applied": false,
    "generated_paths": [],
    "skipped_paths": []
  },
  "history": [
    {
      "timestamp": "2025-12-30T02:50:20.342356Z",
      "event": "created",
      "details": {
        "note": "Example state file."
      }
    }
  ]
}
